<?xml version="1.0" encoding="UTF-8"?>
<!DOCTYPE valores SYSTEM "saura_valores.dtd">
<valores>
	<accion>
		<mercado>Madrid</mercado>
		<nombre>Aceralia</nombre>
		<mercado-abierto>SÍ</mercado-abierto>
		<recomendación>3</recomendación>
		<fecha>
			<día>12</día>
			<mes>07</mes>
			<año>2002</año>
		</fecha>
	</accion>
	<accion>
		<mercado>Madrid</mercado>
		<nombre>Repsol</nombre>
		<mercado-abierto>SÍ</mercado-abierto>
		<recomendación>3</recomendación>
		<fecha>
			<día>12</día>
			<mes>07</mes>
			<año>2002</año>
		</fecha>
	</accion>
</valores>
